{
  "toolspec": "0.1",

  "service": {
    "name": "MusicBrainz",
    "description": "Open music encyclopedia providing structured metadata about artists, releases, recordings, labels, works, and more. Supports three core operations per entity: lookup by MBID, Lucene-powered search, and browse of linked entities with pagination. Also supports non-MBID lookups by disc ID, ISRC, and ISWC. All responses are JSON when fmt=json is specified. Requires a descriptive User-Agent header; requests without one are rejected with HTTP 403. Rate-limited to 1 request per second per IP.",
    "version": "2.0.0",
    "provider": {
      "name": "MetaBrainz Foundation",
      "url": "https://musicbrainz.org",
      "contact": "support@metabrainz.org"
    },
    "tags": ["music", "metadata", "artists", "releases", "recordings", "labels", "works", "open-data", "musicbrainz", "MBID"]
  },

  "base_url": "https://musicbrainz.org/ws/2",

  "auth": {
    "required": false,
    "schemes": [
      {
        "type": "none",
        "description": "No authentication for read-only GET requests. A custom User-Agent header is MANDATORY (e.g., 'MyApp/1.0 (contact@example.com)'). Requests with a generic or missing User-Agent receive HTTP 403. POST requests (tag/rating/ISRC/barcode submission) require OAuth or HTTP digest authentication."
      }
    ]
  },

  "capabilities": {
    "streaming": false,
    "async_tasks": false,
    "default_timeout_seconds": 15,
    "rate_limit": {
      "requests_per_minute": 50
    }
  },

  "state": {
    "type": "stateless"
  },

  "tools": [

    {
      "name": "lookup_area",
      "description": "Retrieves detailed information about a specific area by MBID. Areas represent geographic regions (countries, cities, subdivisions). Supports inc= for aliases, annotation, tags, genres, ratings, and relationship types (*-rels).",
      "when_to_use": "When you have an area MBID and want details about that geographic region, its ISO codes, or its relationships to other entities.",
      "endpoint": { "method": "GET", "path": "/area/{mbid}" },
      "parameters": {
        "type": "object",
        "properties": {
          "mbid": { "type": "string", "description": "Area MBID (UUID)." },
          "fmt": { "type": "string", "enum": ["json"], "description": "Response format." },
          "inc": { "type": "string", "description": "Subqueries joined with '+'. Valid: aliases, annotation, tags, genres, ratings, and any *-rels (e.g., area-rels, artist-rels, url-rels)." }
        },
        "required": ["mbid", "fmt"]
      },
      "response": {
        "type": "object",
        "properties": {
          "id": { "type": "string" }, "name": { "type": "string" }, "type": { "type": "string" },
          "sort-name": { "type": "string" },
          "iso-3166-1-codes": { "type": "array", "items": { "type": "string" } },
          "iso-3166-2-codes": { "type": "array", "items": { "type": "string" } },
          "life-span": { "type": "object", "properties": { "begin": { "type": "string" }, "end": { "type": "string" }, "ended": { "type": "boolean" } } },
          "aliases": { "type": "array", "items": { "type": "object" } },
          "relations": { "type": "array", "items": { "type": "object" } }
        }
      },
      "errors": [
        { "code": 400, "description": "Invalid MBID or inc parameter." },
        { "code": 404, "description": "Area not found." },
        { "code": 403, "description": "Missing User-Agent header." },
        { "code": 503, "description": "Rate limit exceeded." }
      ],
      "estimated_duration_seconds": 2,
      "idempotent": true
    },

    {
      "name": "lookup_artist",
      "description": "Retrieves detailed information about a specific artist by MBID. Supports subquery inc= to include linked entities: recordings, releases, release-groups, works. Also supports aliases, annotation, tags, genres, ratings, and all *-rels. When including releases or release-groups, filter with type= and status=. Linked entities capped at 25; use browse for full lists.",
      "when_to_use": "When you have an artist MBID and want full details, optionally including their releases, works, tags, or relationships.",
      "endpoint": { "method": "GET", "path": "/artist/{mbid}" },
      "parameters": {
        "type": "object",
        "properties": {
          "mbid": { "type": "string", "description": "Artist MBID (UUID)." },
          "fmt": { "type": "string", "enum": ["json"], "description": "Response format." },
          "inc": { "type": "string", "description": "Subqueries joined with '+'. Entity includes: recordings, releases, release-groups, works. Modifiers: aliases, annotation, tags, genres, ratings, discids, media, isrcs, artist-credits, various-artists. Rels: area-rels, artist-rels, event-rels, label-rels, place-rels, recording-rels, release-rels, release-group-rels, series-rels, url-rels, work-rels." },
          "type": { "type": "string", "description": "Filter included release-groups/releases by type: album, single, ep, broadcast, other, compilation, live, remix, soundtrack, etc." },
          "status": { "type": "string", "description": "Filter included releases by status: official, promotion, bootleg, pseudo-release, withdrawn, cancelled." }
        },
        "required": ["mbid", "fmt"]
      },
      "response": {
        "type": "object",
        "properties": {
          "id": { "type": "string" }, "name": { "type": "string" }, "sort-name": { "type": "string" },
          "type": { "type": "string", "description": "Person, Group, Orchestra, Choir, Character, Other." },
          "country": { "type": "string" }, "disambiguation": { "type": "string" }, "gender": { "type": "string" },
          "area": { "type": "object", "properties": { "id": { "type": "string" }, "name": { "type": "string" } } },
          "begin-area": { "type": "object", "properties": { "id": { "type": "string" }, "name": { "type": "string" } } },
          "end-area": { "type": "object", "properties": { "id": { "type": "string" }, "name": { "type": "string" } } },
          "life-span": { "type": "object", "properties": { "begin": { "type": "string" }, "end": { "type": "string" }, "ended": { "type": "boolean" } } },
          "ipis": { "type": "array", "items": { "type": "string" } },
          "isnis": { "type": "array", "items": { "type": "string" } },
          "releases": { "type": "array", "description": "When inc=releases. Max 25.", "items": { "type": "object", "properties": { "id": { "type": "string" }, "title": { "type": "string" }, "status": { "type": "string" }, "date": { "type": "string" }, "country": { "type": "string" }, "release-group": { "type": "object" }, "track-count": { "type": "integer" } } } },
          "release-groups": { "type": "array", "description": "When inc=release-groups. Max 25.", "items": { "type": "object", "properties": { "id": { "type": "string" }, "title": { "type": "string" }, "primary-type": { "type": "string" }, "secondary-types": { "type": "array", "items": { "type": "string" } } } } },
          "recordings": { "type": "array", "description": "When inc=recordings. Max 25." },
          "works": { "type": "array", "description": "When inc=works. Max 25." },
          "aliases": { "type": "array" }, "tags": { "type": "array" }, "genres": { "type": "array" }, "relations": { "type": "array" }
        }
      },
      "errors": [
        { "code": 400, "description": "Invalid MBID or inc combination. Cannot combine recordings and releases in one lookup." },
        { "code": 404, "description": "Artist not found. Search by name first." },
        { "code": 403, "description": "Missing User-Agent header." },
        { "code": 503, "description": "Rate limit exceeded." }
      ],
      "estimated_duration_seconds": 3,
      "idempotent": true
    },

    {
      "name": "lookup_event",
      "description": "Retrieves detailed information about a specific event by MBID. Events represent concerts, festivals, etc. Supports inc= for aliases, annotation, tags, genres, ratings, and *-rels.",
      "when_to_use": "When you have an event MBID and want details about a concert, festival, or other music event.",
      "endpoint": { "method": "GET", "path": "/event/{mbid}" },
      "parameters": {
        "type": "object",
        "properties": {
          "mbid": { "type": "string", "description": "Event MBID (UUID)." },
          "fmt": { "type": "string", "enum": ["json"] },
          "inc": { "type": "string", "description": "Valid: aliases, annotation, tags, genres, ratings, and *-rels." }
        },
        "required": ["mbid", "fmt"]
      },
      "response": { "type": "object", "properties": { "id": { "type": "string" }, "name": { "type": "string" }, "type": { "type": "string" }, "disambiguation": { "type": "string" }, "cancelled": { "type": "boolean" }, "time": { "type": "string" }, "setlist": { "type": "string" }, "life-span": { "type": "object" }, "relations": { "type": "array" } } },
      "errors": [ { "code": 404, "description": "Event not found." }, { "code": 403, "description": "Missing User-Agent." }, { "code": 503, "description": "Rate limit." } ],
      "estimated_duration_seconds": 2, "idempotent": true
    },

    {
      "name": "lookup_genre",
      "description": "Retrieves information about a specific genre by MBID. No inc parameters supported.",
      "when_to_use": "When you have a genre MBID and want its details.",
      "endpoint": { "method": "GET", "path": "/genre/{mbid}" },
      "parameters": { "type": "object", "properties": { "mbid": { "type": "string" }, "fmt": { "type": "string", "enum": ["json"] } }, "required": ["mbid", "fmt"] },
      "response": { "type": "object", "properties": { "id": { "type": "string" }, "name": { "type": "string" }, "disambiguation": { "type": "string" } } },
      "errors": [ { "code": 404, "description": "Genre not found." }, { "code": 403, "description": "Missing User-Agent." } ],